{
  "application_hash": {
    "candidate": "P2BB512-v1",
    "capacity": 12,
    "digest_bytes": 64,
    "digest_fields": 16,
    "domain_scheme": "v0.3 typed tags plus byte/element length and aux",
    "family": "Poseidon2",
    "field": "BabyBear",
    "mode": "rate-4 sponge",
    "rate": 4,
    "review_status": "independent structural cryptanalysis outstanding",
    "state_width": 16
  },
  "artifacts": [
    {
      "bytes": 2836,
      "description": "Exact v0.3 public statement input",
      "digests": {
        "keccak256": "b325d0a9452668aece9ecaa349238f8292df6e2f95ecf497ad3af41c2b7f643d",
        "sha256": "ceb1c877c4488d13c13ea88b3e924dd8a4138a4d4dec9323561089e139cdfc4d"
      },
      "media_type": "application/json",
      "path": "research/candidates/v03-baseline/proofs/v03-fixed-13/statement.json"
    },
    {
      "bytes": 17524,
      "description": "Exact synthetic benchmark private witness; never production material",
      "digests": {
        "keccak256": "e5d72832dc8c8547e5c39d38b01852c642915afcc538a1b11a53ebb7c625bc2f",
        "sha256": "29885fead4e9cf1e79969eeaf37768b1dfa221962852cce98d08d8dd0b3ed00f"
      },
      "media_type": "application/json",
      "path": "research/candidates/v03-baseline/proofs/v03-fixed-13/witness.json"
    },
    {
      "bytes": 204,
      "description": "Candidate derivation with original semantic source case",
      "digests": {
        "keccak256": "e929ba235e0dd6735643507819fed80e9026090295ec8771177c56d9328552b8",
        "sha256": "ca5b06f884e9ca4600f45e9c67772d214c09aafb5ab75e36d566f3b591463cd4"
      },
      "media_type": "application/json",
      "path": "research/candidates/v03-baseline/proofs/v03-fixed-13/derived-case.json"
    },
    {
      "bytes": 101,
      "description": "Explicit rejection-sampling record",
      "digests": {
        "keccak256": "aaa8ed384ef1d164745944c950354057da2b4a769e37edc3ce8820b336882f61",
        "sha256": "9648c1acc99a74e692c408f1487bfcde444f49e429894046af4c6253db92e9fe"
      },
      "media_type": "application/json",
      "path": "research/candidates/v03-baseline/proofs/v03-fixed-13/mapping.json"
    },
    {
      "bytes": 107174,
      "description": "Canonical proof part A",
      "digests": {
        "keccak256": "3812160d7d92d901da266c020e57051cbed08a26ade1e1fe90c4b4c26cd4adc8",
        "sha256": "6075075d01727d405425ef6b2afaebf3ff7b8df73eff089dd0587710fff0c221"
      },
      "media_type": "application/octet-stream",
      "path": "research/candidates/v03-baseline/proofs/v03-fixed-13/part-a.pqtc"
    },
    {
      "bytes": 103494,
      "description": "Canonical proof part B",
      "digests": {
        "keccak256": "625cc8922a6ab57cd659955ee3b6f393c969c3a2a0dab71f30b2134193f2a442",
        "sha256": "b8c781d794e520fcef0d95fb659c3b08c0ddd876f2246c029e511d455b95da65"
      },
      "media_type": "application/octet-stream",
      "path": "research/candidates/v03-baseline/proofs/v03-fixed-13/part-b.pqtc"
    },
    {
      "bytes": 107492,
      "description": "Exact beginWithdrawal calldata for the fixed research harness address",
      "digests": {
        "keccak256": "96309acf23ede9070c1f52de7796e24bd14457e19388e07671ec580e455e1b14",
        "sha256": "b9b23f13df6d1cc8a4dd1be60ad72ac59c3cf4e5284536a0022173380de23284"
      },
      "media_type": "application/vnd.ethereum.calldata",
      "path": "research/candidates/v03-baseline/proofs/v03-fixed-13/part-a.calldata"
    },
    {
      "bytes": 103844,
      "description": "Exact withdraw calldata including consumer-bound verification ID",
      "digests": {
        "keccak256": "d63af15993f0824f0e1c4c4c109faaf171d0cc1c26b5f1104085e88c1174a5d8",
        "sha256": "a744752638a6fa9f6399eda55e0f42472009543db7a8d0ad5943ddc2f726cae9"
      },
      "media_type": "application/vnd.ethereum.calldata",
      "path": "research/candidates/v03-baseline/proofs/v03-fixed-13/part-b.calldata"
    }
  ],
  "candidate_id": "C00/v03-baseline",
  "evm": {
    "chain_config_hash": null,
    "client": "Foundry local EVM",
    "client_version": "forge Version: 1.7.1",
    "component_gas": {
      "pool_a_execution": 15027962,
      "pool_a_standard_intrinsic": 1730828,
      "pool_b_execution": 12285973,
      "pool_b_standard_intrinsic": 1672280
    },
    "deployment_gas": 0,
    "execution_gas": 15027962,
    "gas_scenarios": [
      {
        "floor_gas": 4295570,
        "floor_is_binding": false,
        "name": "ACTIVE_EIP7623",
        "total_gas": 16758790,
        "tx_cap_margin": 18426
      },
      {
        "floor_gas": 6900488,
        "floor_is_binding": false,
        "name": "SCENARIO_EIP7976_64_PER_BYTE",
        "total_gas": 16758790,
        "tx_cap_margin": 18426
      },
      {
        "floor_gas": 10340232,
        "floor_is_binding": false,
        "name": "SCENARIO_EIP8311_96_PER_BYTE",
        "total_gas": 16758790,
        "tx_cap_margin": 18426
      }
    ],
    "initcode_bytes": 0,
    "measured": true,
    "measurement_status": "PASS: complete pool A/B calls; top-level receipt fields remain NOT_EVALUATED because Foundry test execution is not a mined transaction",
    "opcode_counts": {},
    "opcode_status": "NOT_EVALUATED by this command; use opcode-profile.py",
    "part_b_gas_scenarios": [
      {
        "floor_gas": 4149200,
        "floor_is_binding": false,
        "name": "ACTIVE_EIP7623",
        "total_gas": 13958253,
        "tx_cap_margin": 2818963
      },
      {
        "floor_gas": 6667016,
        "floor_is_binding": false,
        "name": "SCENARIO_EIP7976_64_PER_BYTE",
        "total_gas": 13958253,
        "tx_cap_margin": 2818963
      },
      {
        "floor_gas": 9990024,
        "floor_is_binding": false,
        "name": "SCENARIO_EIP8311_96_PER_BYTE",
        "total_gas": 13958253,
        "tx_cap_margin": 2818963
      }
    ],
    "receipt_block": null,
    "receipt_gas_used": 0,
    "receipt_status": "NOT_EVALUATED",
    "runtime_bytes": 0,
    "runtime_status": "NOT_EVALUATED by this command; use measure-deployment.sh",
    "standard_intrinsic_gas": 1730828,
    "transaction_gas_limit": 16777216,
    "transaction_hash": null
  },
  "git": {
    "branch_or_tag": "pqtc-v0.3-research-baseline",
    "commit": "00f829001999ee66da6fd5161c4c205c07d0b937",
    "dirty": true,
    "repository": "/Users/zodomo/code/PQTornado",
    "submodules": {}
  },
  "hardware": {
    "allocator": null,
    "architecture": "arm64",
    "cpu_affinity": null,
    "cpu_features": [],
    "cpu_model": "Apple M4 Max",
    "hardware_id": "macnch33z3.local-arm64",
    "kernel": "24.6.0",
    "logical_cores": 16,
    "os": "macOS-15.7.9-arm64-arm-64bit-Mach-O",
    "physical_cores": 16,
    "power_mode": null,
    "ram_bytes": 51539607552,
    "threads_used": 16
  },
  "proof_bytes": {
    "abi_calldata_bytes": 211336,
    "calldata_nonzero_bytes": 209647,
    "calldata_zero_bytes": 1689,
    "frontier_status": "NOT_EVALUATED: the v0.3 public codec API does not expose split-query pruned-frontier lengths",
    "nonzero_bytes": 209262,
    "raw_proof_bytes": 210668,
    "sections": {
      "part_a": 107174,
      "part_b": 103494
    },
    "unique_query_indices": 32,
    "zero_bytes": 1406
  },
  "proof_system": {
    "base_field": "BabyBear",
    "challenge_field": "degree-4 BabyBear extension",
    "challenge_field_bits": 120,
    "classical_wrapper": false,
    "commit_grinding_bits_configured": 16,
    "final_polynomial_length": 1,
    "fold_schedule": "nine binary rounds",
    "hiding": true,
    "hiding_construction": "four random codewords and eight MMCS salt fields per leaf",
    "log_blowup": 4,
    "mmcs_digest_bytes": 64,
    "name": "Plonky3 hiding two-adic FRI STARK q32",
    "pcs_or_ldt": "hiding two-adic FRI",
    "query_count": 32,
    "query_grinding_bits_configured": 16,
    "random_codewords": 4,
    "salt_fields": 8,
    "transcript": "KeccakPair512",
    "trusted_setup": false
  },
  "protocol": {
    "asset": "native ETH",
    "case_id": "fixed-baseline",
    "denomination_wei": "1000000000000000000",
    "semantic_source_kind": "fixed-baseline",
    "semantic_version": "3",
    "transaction_shape": "OTHER",
    "tree_arity": 2,
    "tree_depth": 20
  },
  "prover": {
    "cold_or_warm": "WARM",
    "cpu_ms": null,
    "native_verify_ms": 2.12025,
    "peak_rss_bytes": 28508160,
    "peak_rss_status": null,
    "proof_only_ms": 458.723125,
    "success": true,
    "wall_ms": 478.36979100247845
  },
  "relation": {
    "active_rows": 244,
    "base_degree_bits": 8,
    "batched_functions": 210,
    "constraint_count": 1186,
    "hiding_degree_bits": 9,
    "kind": "AIR",
    "logical_rows": 256,
    "max_degree": 7,
    "nonzero_count_status": "NOT_EVALUATED: frozen AIR does not expose this count",
    "padded_rows": 256,
    "padding_rows": 12,
    "quotient_chunks": 16,
    "trace_width": 190
  },
  "result": {
    "confounders": [
      "EVM and deployment measurements have not run",
      "valid-proof maximum frontier/gas is unproven"
    ],
    "failure_reason": null,
    "gate_status": "NOT_EVALUATED",
    "notes": [
      "Native proof and codec round trip verified",
      "OS hiding entropy used",
      "Synthetic benchmark secrets are intentionally published and must never be reused",
      "Complete pool-facing A/B calls verified in Foundry; deployment and opcode gates remain NOT_EVALUATED"
    ],
    "success": true
  },
  "run_id": "v03-fixed-13",
  "schema_version": "1",
  "security": {
    "classification": "PQ_ORIENTED_RESEARCH",
    "external_review": null,
    "lowest_accepted_bits": 56,
    "qrom_status": "No complete QROM proof for custom transcript/composition",
    "terms": [
      {
        "binding": false,
        "classical_bits": 107,
        "formula_source": "parameters/sepolia-v0.3/security-analysis.json",
        "model": "generated v0.3 conjecture",
        "multi_target_count_log2": null,
        "name": "FRI random-words",
        "notes": [
          "Not a proven 100-bit claim"
        ],